{
  "schema": "rocell.actual_ai_arm_compatibility_report.v1",
  "corpus_id": "pc18-actual-ai-arm-compatibility-v1",
  "corpus_file_sha256": "d99ed05afdd41374543618446b74ebd8cae162310b0d2092e040c96a345659d6",
  "case_count": 13,
  "passed_case_count": 13,
  "cases": [
    {
      "case_id": "actual-emitter-hhi-supported",
      "source_class": "ACTUAL_AI_BATCH_EMITTER",
      "disposition": "TRAJECTORY_COMPILED",
      "ordered_target_ids": [
        "H",
        "H",
        "I"
      ],
      "contact_target_ids": [
        "H",
        "H",
        "I"
      ],
      "batch_payload_sha256": "59beb8375008d44951a206a135ba0e6094509f04b58d948c6ba7741d9d841299",
      "batch_sha256": "d9709bf5556072db7f51e3278cb46e8c9d7ad988dc63ad5b8da3b498b859e6d4",
      "ingress_sha256": "c7a25ba7f8e5d76aa62ec8de5f4e662bdcb941605ccf35eb4bad73d0d8a48ff0",
      "preplanner_gate_sha256": "2c3161aa6061dc6a8f076f7482986a0b516c5bc44595391c1578f199ae0134a0",
      "execution_plan_sha256": "93a8af9b30556178202d35e7246abb609ea5bfd028de4b4603647398299e10e8",
      "trajectory_plan_sha256": "8643fc0f9697848025286598ff9cc24b1075a99d8a132ac676e5b4b21957e551",
      "controller_commands": [],
      "hardware_access": false,
      "physical_authority": false
    },
    {
      "case_id": "actual-emitter-mixed-supported",
      "source_class": "ACTUAL_AI_BATCH_EMITTER",
      "disposition": "TRAJECTORY_COMPILED",
      "ordered_target_ids": [
        "R",
        "O",
        "B",
        "O",
        "T",
        "SPACE",
        "B",
        "O",
        "O",
        "K",
        "SPACE",
        "1",
        "0",
        "PERIOD",
        "ENTER"
      ],
      "contact_target_ids": [
        "R",
        "O",
        "B",
        "O",
        "T",
        "SPACE",
        "B",
        "O",
        "O",
        "K",
        "SPACE",
        "1",
        "0",
        "PERIOD",
        "ENTER"
      ],
      "batch_payload_sha256": "986dbf665a58124147e81458e469fece4f16a41da8c43866340e7926791c9b92",
      "batch_sha256": "b8437e6a9fc95fa4902accf154f314a96b2ad7047d05e3a5345c4105fa79e28b",
      "ingress_sha256": "c0280fcb756974495e9de71280c001e7e3d68f279ef14fd47ca3ab9620a03dfd",
      "preplanner_gate_sha256": "7a3fbffedd0735ebc46e6423b7e5cd260cf6dca214f2235ec9df8b1512ea5d40",
      "execution_plan_sha256": "a6245a0ede18bee9139820255d7ddf557824367da295c2c042b6eb7e7a1c9861",
      "trajectory_plan_sha256": "8516f3dbb9f9c51be12e226cef9a8861ed486f149c77167c72bc180d2b42887d",
      "controller_commands": [],
      "hardware_access": false,
      "physical_authority": false
    },
    {
      "case_id": "actual-emitter-all46-supported",
      "source_class": "ACTUAL_AI_BATCH_EMITTER",
      "disposition": "TRAJECTORY_COMPILED",
      "ordered_target_ids": [
        "0",
        "1",
        "2",
        "3",
        "4",
        "5",
        "6",
        "7",
        "8",
        "9",
        "A",
        "APOSTROPHE",
        "B",
        "C",
        "COMMA",
        "D",
        "E",
        "ENTER",
        "EQUAL",
        "F",
        "G",
        "H",
        "I",
        "J",
        "K",
        "L",
        "M",
        "MINUS",
        "N",
        "O",
        "P",
        "PERIOD",
        "Q",
        "R",
        "S",
        "SEMICOLON",
        "SLASH",
        "SPACE",
        "T",
        "TAB",
        "U",
        "V",
        "W",
        "X",
        "Y",
        "Z"
      ],
      "contact_target_ids": [
        "0",
        "1",
        "2",
        "3",
        "4",
        "5",
        "6",
        "7",
        "8",
        "9",
        "A",
        "APOSTROPHE",
        "B",
        "C",
        "COMMA",
        "D",
        "E",
        "ENTER",
        "EQUAL",
        "F",
        "G",
        "H",
        "I",
        "J",
        "K",
        "L",
        "M",
        "MINUS",
        "N",
        "O",
        "P",
        "PERIOD",
        "Q",
        "R",
        "S",
        "SEMICOLON",
        "SLASH",
        "SPACE",
        "T",
        "TAB",
        "U",
        "V",
        "W",
        "X",
        "Y",
        "Z"
      ],
      "batch_payload_sha256": "6f3111a6306ac6d4f3f6e5a700acfd29a4efabb8975f434eb0a1be7b5b32bdde",
      "batch_sha256": "6b5cd86d1d13d56569babe595f51a45cfea4f492548293bc4c9c7fab96a7b984",
      "ingress_sha256": "cfada03827cbf928be7eedbc8cb5a8fc106e57338b059ea0e47d9c52e5777b5e",
      "preplanner_gate_sha256": "7f37c356dd79a8bcf973228df6c92cf692a148e7ffd2b01447a48e67e005caa1",
      "execution_plan_sha256": "d1e65a868c8359201484df67e2f298d284785ed360231314aad1e31b3be12e42",
      "trajectory_plan_sha256": "2b06b7d0fad84169a58ad9788aab61e67290f59404156eab0f375d38515e0db7",
      "controller_commands": [],
      "hardware_access": false,
      "physical_authority": false
    },
    {
      "case_id": "actual-precision-hh1-period-uncertain",
      "source_class": "ACTUAL_OR_DERIVED_AI_BATCH",
      "disposition": "ARM_INGRESS_BLOCKED",
      "blocker_code": "COMPOSED_UNCERTAINTY_OUTSIDE_REGION",
      "ordered_target_ids": [
        "H",
        "H",
        "1",
        "PERIOD"
      ],
      "batch_payload_sha256": "26fa25a5824c2bd3e1b8312f91b801afa02c240487771533b8faed5c4bd531c5",
      "batch_sha256": "ffe9777410258064ee07b1202b3de1f3b972cbcf69b6f4be8732f4e34d885b19",
      "controller_commands": [],
      "hardware_access": false,
      "physical_authority": false
    },
    {
      "case_id": "actual-localization-abstention",
      "source_class": "ACTUAL_AI_PRECISION_FUSION",
      "disposition": "PRODUCER_ABSTAINED",
      "blocker_code": "LOCALIZATION_UNCALIBRATED",
      "ordered_target_ids": [
        "H",
        "H",
        "I"
      ],
      "source_file_sha256": "c5469369df0b2229cc140804e31222b524c8fecae3c448d3d160fc7486c33a94",
      "controller_commands": [],
      "hardware_access": false,
      "physical_authority": false
    },
    {
      "case_id": "unsupported-phone-request",
      "source_class": "ACTUAL_AI_BATCH_EMITTER",
      "disposition": "PRODUCER_REJECTED",
      "blocker_code": "UNSUPPORTED_PHONE_REQUEST",
      "ordered_target_ids": [],
      "controller_commands": [],
      "hardware_access": false,
      "physical_authority": false
    },
    {
      "case_id": "derived-stale-evidence",
      "source_class": "ACTUAL_OR_DERIVED_AI_BATCH",
      "disposition": "ARM_INGRESS_BLOCKED",
      "blocker_code": "STALE_OR_EXPIRED_EVIDENCE",
      "ordered_target_ids": [
        "H",
        "H",
        "I"
      ],
      "batch_payload_sha256": "59beb8375008d44951a206a135ba0e6094509f04b58d948c6ba7741d9d841299",
      "batch_sha256": "d9709bf5556072db7f51e3278cb46e8c9d7ad988dc63ad5b8da3b498b859e6d4",
      "controller_commands": [],
      "hardware_access": false,
      "physical_authority": false
    },
    {
      "case_id": "derived-crossed-image-identity",
      "source_class": "ACTUAL_OR_DERIVED_AI_BATCH",
      "disposition": "ARM_INGRESS_BLOCKED",
      "blocker_code": "CROSSED_EVIDENCE_IDENTITY",
      "ordered_target_ids": [
        "H",
        "H",
        "I"
      ],
      "batch_payload_sha256": "785d6c77afc433116273fc29b6d743ce4cb38c3d0cf8aa8b600fd49b5c9813c8",
      "batch_sha256": "e56b2db3cfa279ab6935b258c375d50329769a7b6b8ba42decf2a5091eb89eea",
      "controller_commands": [],
      "hardware_access": false,
      "physical_authority": false
    },
    {
      "case_id": "derived-low-confidence",
      "source_class": "ACTUAL_OR_DERIVED_AI_BATCH",
      "disposition": "ARM_INGRESS_BLOCKED",
      "blocker_code": "CONFIDENCE_BELOW_POLICY",
      "ordered_target_ids": [
        "H",
        "H",
        "I"
      ],
      "batch_payload_sha256": "281f0fd3a79c9792a438a6488d43f48edceb67dbd2e227bf2b4873b47cf3133f",
      "batch_sha256": "f27b979fd649f2886a16ea3c52a887c83aa462f4f911279a4b22ee87307aaa78",
      "controller_commands": [],
      "hardware_access": false,
      "physical_authority": false
    },
    {
      "case_id": "derived-authority-injection",
      "source_class": "DERIVED_FROM_ACTUAL_AI_BATCH",
      "disposition": "STRICT_DECODER_BLOCKED",
      "blocker_code": "AUTHORITY_INJECTION",
      "ordered_target_ids": [
        "H",
        "H",
        "I"
      ],
      "source_file_sha256": "59beb8375008d44951a206a135ba0e6094509f04b58d948c6ba7741d9d841299",
      "mutated_payload_sha256": "3878f50f301afec211125bc2a74933e2a07048d2cf40f552b586590403ef45cd",
      "controller_commands": [],
      "hardware_access": false,
      "physical_authority": false
    },
    {
      "case_id": "derived-duplicate-json",
      "source_class": "DERIVED_FROM_ACTUAL_AI_BATCH",
      "disposition": "STRICT_DECODER_BLOCKED",
      "blocker_code": "DUPLICATE_JSON_FIELD",
      "ordered_target_ids": [
        "H",
        "H",
        "I"
      ],
      "source_file_sha256": "59beb8375008d44951a206a135ba0e6094509f04b58d948c6ba7741d9d841299",
      "mutated_payload_sha256": "4b7a57e280077c45ede4bd431f566b01c9aba28514b83b1e2070e871f16eb705",
      "controller_commands": [],
      "hardware_access": false,
      "physical_authority": false
    },
    {
      "case_id": "derived-nonfinite-coordinate",
      "source_class": "DERIVED_FROM_ACTUAL_AI_BATCH",
      "disposition": "STRICT_DECODER_BLOCKED",
      "blocker_code": "NONFINITE_NUMBER",
      "ordered_target_ids": [
        "H",
        "H",
        "I"
      ],
      "source_file_sha256": "59beb8375008d44951a206a135ba0e6094509f04b58d948c6ba7741d9d841299",
      "mutated_payload_sha256": "8f716fb0cecf82b2e62cc2fb11419b6d4bbb9467cc61ebb4eb0247172095b4f5",
      "controller_commands": [],
      "hardware_access": false,
      "physical_authority": false
    },
    {
      "case_id": "derived-reordered-actions",
      "source_class": "DERIVED_FROM_ACTUAL_AI_BATCH",
      "disposition": "STRICT_DECODER_BLOCKED",
      "blocker_code": "REORDERED_ACTIONS",
      "ordered_target_ids": [
        "I",
        "H",
        "H"
      ],